{
  "schema_version": 2,
  "id": "allow-terminal-signal-smoke-steps-v1",
  "version": "2.0.0",
  "effect": "ALLOW",
  "scope": {
    "campaign_ids": ["terminal-pty-smoke"],
    "task_ids": ["TERMINAL-SIGNAL-SMOKE"],
    "task_kinds": ["terminal"],
    "driver_types": ["pty"],
    "action_types": [
      "terminal-wait",
      "terminal-signal",
      "terminal-capture"
    ]
  },
  "budgets": {
    "required_dimensions": ["action_count", "output_bytes"],
    "max_actions": 4,
    "max_output_bytes": 8192
  },
  "redaction_profile": "no-secrets-v1",
  "reason": "Allow only the bounded wait, SIGINT, and capture steps of the terminal signal fixture."
}
