{
  "schema_version": 2,
  "id": "allow-agent-standalone-codex-v1",
  "version": "1.0.0",
  "effect": "ALLOW",
  "scope": {
    "campaign_ids": ["agent-standalone-codex-canary"],
    "task_ids": ["AGENT-STANDALONE-CODEX-CANARY"],
    "task_kinds": ["agent-response"],
    "driver_types": ["agent-runtime"],
    "action_types": ["agent-invoke"]
  },
  "budgets": {
    "required_dimensions": ["action_count", "output_bytes"],
    "max_actions": 1,
    "max_output_bytes": 16384
  },
  "redaction_profile": "no-secrets-v1",
  "reason": "Allow only one explicit-instruction, source-blind, read-only, network-denied Codex invocation with no composed tools."
}
