{
  "schema_version": 2,
  "id": "allow-command-missing-output-v1",
  "version": "2.0.0",
  "effect": "ALLOW",
  "scope": {
    "campaign_ids": [
      "command-failure-recovery"
    ],
    "task_ids": [
      "COMMAND-MISSING-OUTPUT"
    ],
    "task_kinds": [
      "command"
    ],
    "driver_types": [
      "direct-process"
    ],
    "action_types": [
      "process-exec"
    ],
    "command_prefix": [
      "/usr/bin/true"
    ]
  },
  "budgets": {
    "required_dimensions": [
      "action_count",
      "output_bytes"
    ],
    "max_actions": 1,
    "max_output_bytes": 4096
  },
  "redaction_profile": "no-secrets-v1",
  "reason": "Allow only the exact deterministic W-005 exit-zero missing-output fixture argv."
}
