{
  "schema_version": 2,
  "id": "allow-agent-response-fixture-v1",
  "version": "1.0.0",
  "effect": "ALLOW",
  "scope": {
    "campaign_ids": ["agent-response-fake-smoke"],
    "task_ids": ["AGENT-RESPONSE-FIXTURE-SMOKE"],
    "task_kinds": ["agent-response"],
    "driver_types": ["agent-runtime"],
    "action_types": ["agent-invoke"]
  },
  "budgets": {
    "required_dimensions": ["action_count", "output_bytes"],
    "max_actions": 1,
    "max_output_bytes": 16384
  },
  "redaction_profile": "no-secrets-v1",
  "reason": "Allow only the source-bound, read-only, network-denied deterministic agent fixture invocation."
}
